title,date,link,image
Vatikan Gunakan Teknologi Pengacak Sinyal Demi Jaga Kerahasiaan Konklaf Paus Baru,"Kamis, 8 Mei 2025 06:07 WIB",https://www.tribunnews.com/internasional/2025/05/08/vatikan-gunakan-teknologi-pengacak-sinyal-demi-jaga-kerahasiaan-konklaf-paus-baru,
"Viral Kucing Jatuh di Minyak Panas Restoran Hotpot China, Dijanjikan Direkrut tapi Tak Bisa Bertahan","Kamis, 8 Mei 2025 06:03 WIB",https://www.tribunnews.com/internasional/2025/05/08/viral-kucing-jatuh-di-minyak-panas-restoran-hotpot-china-dijanjikan-direkrut-tapi-tak-bisa-bertahan,
Mahasiswa Turun Tangan Bantu Warga Lewat Tebus Murah Bahan Pokok,"Kamis, 8 Mei 2025 05:59 WIB",https://www.tribunnews.com/metropolitan/2025/05/08/mahasiswa-turun-tangan-bantu-warga-lewat-tebus-murah-bahan-pokok,
Cerita Tim Gabungan saat Evakuasi Korban Kecelakaan Maut di Purworejo: Butuh Waktu 45 Menit,"Kamis, 8 Mei 2025 05:55 WIB",https://www.tribunnews.com/regional/2025/05/08/cerita-tim-gabungan-saat-evakuasi-korban-kecelakaan-maut-di-purworejo-butuh-waktu-45-menit,
"KABAR HAJI, Kakbah Mulai Padat, Jemaah Haji dari Banglades, Pakistan & Turki Penuhi Masjidil Haram","Kamis, 8 Mei 2025 05:51 WIB",https://www.tribunnews.com/haji/2025/05/08/kabar-haji-kakbah-mulai-padat-jemaah-haji-dari-banglades-pakistan-turki-penuhi-masjidil-haram,
"Fakta Hasil PSG vs Arsenal: Kans Treble Winners Les Parisiens Terjaga, The Gunners Bapuk di UCL","Kamis, 8 Mei 2025 05:48 WIB",https://www.tribunnews.com/superskor/2025/05/08/fakta-hasil-psg-vs-arsenal-kans-treble-winners-les-parisiens-terjaga-the-gunners-bapuk-di-ucl,
Kejagung Ungkap Peran Bos Buzzer Penghalang Kasus Korupsi: Rekrut 150 Anggota dan Hapus Barang Bukti,"Kamis, 8 Mei 2025 05:43 WIB",https://www.tribunnews.com/nasional/2025/05/08/kejagung-ungkap-peran-bos-buzzer-penghalang-kasus-korupsi-rekrut-150-anggota-dan-hapus-barang-bukti,
"Hasil Drawing Thailand Open 2025: Chico Aura vs Kodai Naraoka, 2 Ganda Putri Jalani Perang Saudara","Kamis, 8 Mei 2025 05:42 WIB",https://www.tribunnews.com/sport/2025/05/08/hasil-drawing-thailand-open-2025-chico-aura-vs-kodai-naraoka-2-ganda-putri-jalani-perang-saudara,
"Harga Sapi Kurban 2025 untuk Idul Adha, Cek Daftar Lengkapnya","Kamis, 8 Mei 2025 05:41 WIB",https://www.tribunnews.com/nasional/2025/05/08/harga-sapi-kurban-2025-untuk-idul-adha-cek-daftar-lengkapnya,
"Kenang Sosok Ustazah yang Tewas Dalam Kecelakaan Maut di Purworejo, Maftuhin: Tadi Sempat Bergurau","Kamis, 8 Mei 2025 05:38 WIB",https://www.tribunnews.com/regional/2025/05/08/kenang-sosok-ustazah-yang-tewas-dalam-kecelakaan-maut-di-purworejo-maftuhin-tadi-sempat-bergurau,
"Kondisi Angkot Remuk, Evakuasi Korban Kecelakaan Maut di Kalijambe Purworejo Butuh Waktu 45 Menit","Kamis, 8 Mei 2025 05:35 WIB",https://www.tribunnews.com/regional/2025/05/08/kondisi-angkot-remuk-evakuasi-korban-kecelakaan-maut-di-kalijambe-purworejo-butuh-waktu-45-menit,
"Ridwan Kamil Terseret Kasus Korupsi Dana Iklan Rp409 M, Bahlil Belum Pastikan Beri Bantuan Hukum","Kamis, 8 Mei 2025 05:34 WIB",https://www.tribunnews.com/nasional/2025/05/08/ridwan-kamil-terseret-kasus-korupsi-dana-iklan-rp409-m-golkar-belum-pastikan-beri-bantuan-hukum,
Doa Kardinal Re sebelum Konklaf Dimulai: Semoga Terpilih Paus yang Dibutuhkan Zaman Ini,"Kamis, 8 Mei 2025 05:09 WIB",https://www.tribunnews.com/internasional/2025/05/08/doa-kardinal-re-sebelum-konklaf-dimulai-semoga-terpilih-paus-yang-dibutuhkan-zaman-ini,
"Usai Dituding Tak Mau Bayar Paylater, Nana Mirdad Pergoki Bagasi Mobil Tiba-tiba Terbuka saat Parkir","Kamis, 8 Mei 2025 05:06 WIB",https://www.tribunnews.com/seleb/2025/05/08/usai-dituding-tak-mau-bayar-paylater-nana-mirdad-pergoki-bagasi-mobil-tiba-tiba-terbuka-saat-parkir,
Bos Buzzer Diguyur Rp864 Juta untuk Sebarkan Konten Negatif Penyidikan Kasus Korupsi Besar,"Kamis, 8 Mei 2025 05:05 WIB",https://www.tribunnews.com/nasional/2025/05/08/bos-buzzer-diguyur-rp864-juta-untuk-sebarkan-konten-negatif-penyidikan-kasus-korupsi-besar,
"Top Skor Liga Arab Saudi: Absen Nyekor untuk Al Nassr, Ronaldo Dikejar Ivan Toney","Kamis, 8 Mei 2025 04:59 WIB",https://www.tribunnews.com/superskor/2025/05/08/top-skor-liga-arab-saudi-absen-nyekor-untuk-al-nassr-ronaldo-dikejar-ivan-toney,
"Nasib Pilu Bayi Alfonsus yang Selamat dari Kecelakaan Bus ALS, Berjuang Sembuh, Muka Penuh Perban","Kamis, 8 Mei 2025 04:58 WIB",https://www.tribunnews.com/regional/2025/05/08/nasib-pilu-bayi-alfonsus-yang-selamat-dari-kecelakaan-bus-als-berjuang-sembuh-muka-penuh-perban,
"Demokrat Tak Terpancing dengan Usulan Pemakzulan Gibran, Fokus Dukung Pemerintah","Kamis, 8 Mei 2025 04:43 WIB",https://www.tribunnews.com/nasional/2025/05/08/demokrat-tak-terpancing-dengan-usulan-pemakzulan-gibranfokus-dukung-pemerintah,
MKGR Siap Beri 'Karpet Merah' untuk Jokowi dan Gibran: ''Kami Tidak Menawarkan'',"Kamis, 8 Mei 2025 04:30 WIB",https://www.tribunnews.com/nasional/2025/05/08/mkgr-siap-beri-karpet-merah-untuk-jokowi-dan-gibran-kami-tidak-menawarkan,
"Kejagung Tetapkan WN Hungaria Tersangka Korupsi Satelit Kemhan, Kerugian Negara Lebih Rp 300 M","Kamis, 8 Mei 2025 04:16 WIB",https://www.tribunnews.com/nasional/2025/05/08/kejagung-tetapkan-wn-hungaria-tersangka-korupsi-satelit-kemhan-kerugian-negara-lebih-rp-300-m,
"Ahmad Albar Mengaku Tak Suka Fachry Albar Kembali Terjerat Narkoba, Tapi Janji  Tetap Urusi Anaknya","Kamis, 8 Mei 2025 07:21 WIB",https://www.tribunnews.com/seleb/2025/05/08/ahmad-albar-mengaku-tak-suka-fachry-albar-kembali-terjerat-narkoba-tapi-janji-tetap-urusi-anaknya,
"Respons Aduan Pembelian Tiket Konser Day6 di Jakarta, Kemendag Panggil Mecimapro dan Tiket.com","Kamis, 8 Mei 2025 07:20 WIB",https://www.tribunnews.com/bisnis/2025/05/08/respons-aduan-pembelian-tiket-konser-day6-di-jakarta-kemendag-panggil-mecimapro-dan-tiketcom,
Imparsial Sebut Menhan Tidak Paham Hak Warga Negara Karena Sebut UU TNI Sudah Final,"Kamis, 8 Mei 2025 07:20 WIB",https://www.tribunnews.com/nasional/2025/05/08/imparsial-sebut-menhan-tidak-paham-hak-warga-negara-karena-sebut-uu-tni-sudah-final,
"KPK Terima 802 Laporan Gratifikasi Lebaran 2025, Nilainya Rp 506 Juta","Kamis, 8 Mei 2025 07:15 WIB",https://www.tribunnews.com/nasional/2025/05/08/kpk-terima-802-laporan-gratifikasi-lebaran-2025-nilainya-rp-506-juta,
"Kabar Terbaru Anthony Ginting Sejak 4 Bulan Menepi Gegara Cedera, Buka Kans Comeback Juli Mendatang","Kamis, 8 Mei 2025 07:07 WIB",https://www.tribunnews.com/sport/2025/05/08/kabar-terbaru-anthony-ginting-sejak-4-bulan-menepi-gegara-cedera-buka-kans-comeback-juli-mendatang,
"Tangisan Raffi Ahmad Saksikan Luna Maya Dinikahi Maxime Bouttier, Ingat Cerita Masa Lalu","Kamis, 8 Mei 2025 07:03 WIB",https://www.tribunnews.com/seleb/2025/05/08/tangisan-raffi-ahmad-saksikan-luna-maya-dinikahi-maxime-bouttier-ingat-cerita-masa-lalu,
"Ketua KPK Sebut Direksi dan Komisaris BUMN Tetap Penyelenggara Negara, Wajib Lapor LHKPN","Kamis, 8 Mei 2025 07:00 WIB",https://www.tribunnews.com/nasional/2025/05/08/ketua-kpk-sebut-direksi-dan-komisaris-bumn-tetap-penyelenggara-negara-wajib-lapor-lhkpn,
"Jadwal Pemadaman Listrik 8 Mei 2025: Cek Wilayah Terdampak di Palu, Yogyakarta, Jateng, dan Sulut","Kamis, 8 Mei 2025 07:00 WIB",https://www.tribunnews.com/regional/2025/05/08/jadwal-pemadaman-listrik-8-mei-2025-cek-wilayah-terdampak-di-palu-yogyakarta-jateng-dan-sulut,
"Sambut Paus Baru, Penjahit Vatikan Siapkan Jubah Khusus untuk Pengganti Fransiskus","Kamis, 8 Mei 2025 06:47 WIB",https://www.tribunnews.com/internasional/2025/05/08/sambut-paus-baru-penjahit-vatikan-siapkan-jubah-khusus-untuk-pengganti-fransiskus,
"Jahe Merah dan Gaun Pengantin, Kolaborasi Tak Biasa di Panggung Mode Paris","Kamis, 8 Mei 2025 06:45 WIB",https://www.tribunnews.com/lifestyle/2025/05/08/jahe-merah-dan-gaun-pengantin-kolaborasi-tak-biasa-di-panggung-mode-paris,
"Prabowo Dukung Pengesahan RUU Perampasan Aset, DPR Persilakan Pemerintah Ajukan Surpres Baru","Kamis, 8 Mei 2025 06:39 WIB",https://www.tribunnews.com/nasional/2025/05/08/prabowo-dukung-pengesahan-ruu-perampasan-aset-dpr-persilakan-pemerintah-ajukan-surpres-baru,
"DPR RI Jadi Tuan Rumah Konferensi Parlemen Negara OKI, Bakal Suarakan Kemerdekaan Palestina","Kamis, 8 Mei 2025 06:39 WIB",https://www.tribunnews.com/nasional/2025/05/08/dpr-ri-jadi-tuan-rumah-konferensi-parlemen-negara-oki-bakal-suarakan-kemerdekaan-palestina,
"Sosok Intan Nurul, Wabup Tangerang Ingin Tiru Dedi Mulyadi Kirim Anak Nakal ke Barak untuk Efek Jera","Kamis, 8 Mei 2025 06:39 WIB",https://www.tribunnews.com/regional/2025/05/08/sosok-intan-nurul-wabup-tangerang-ingin-tiru-dedi-mulyadi-kirim-anak-nakal-ke-barak-untuk-efek-jera,
"Komentar Arteta setelah Arsenal Gagal Lolos Final Liga Champions, Sebut Kiper PSG Gada Ada Obat","Kamis, 8 Mei 2025 06:34 WIB",https://www.tribunnews.com/superskor/2025/05/08/komentar-arteta-setelah-arsenal-gagal-lolos-final-liga-champions-sebut-kiper-psg-gada-ada-obat,
Alasan Roy Suryo Persoalkan Ijazah Jokowi Meski Tak Lagi Jadi Presiden,"Kamis, 8 Mei 2025 06:32 WIB",https://www.tribunnews.com/nasional/2025/05/08/alasan-roy-suryo-persoalkan-ijazah-jokowi-meski-tak-lagi-jadi-presiden,
"Desain Gedung Legislatif-Yudikatif di IKN Telah Rampung, Hanya Tunggu Restu Prabowo","Kamis, 8 Mei 2025 06:32 WIB",https://www.tribunnews.com/bisnis/2025/05/08/desain-gedung-legislatif-yudikatif-di-ikn-telah-rampung-hanya-tunggu-restu-prabowo,
YLBHI: Militerisme di Indonesia Sudah Terlihat di Era Jokowi Terang-terangan di Kepemimpinan Prabowo,"Kamis, 8 Mei 2025 06:29 WIB",https://www.tribunnews.com/nasional/2025/05/08/ylbhi-militerisme-di-indonesia-sudah-terlihat-di-era-jokowi-terang-terangan-di-kepemimpinan-prabowo,
"Sosok Fuji di Mata Ayah Verrell Bramasta: Baik, Dia Orang yang Mandiri","Kamis, 8 Mei 2025 06:27 WIB",https://www.tribunnews.com/seleb/2025/05/08/sosok-fuji-di-mata-ayah-verrell-bramasta-baik-dia-orang-yang-mandiri,
"Purnawirawan TNI Gulirkan Pemakzulan Gibran, Golkar Solid Kawal Pemerintahan yang Sah Hingga 2029","Kamis, 8 Mei 2025 06:18 WIB",https://www.tribunnews.com/nasional/2025/05/08/purnawirawan-tni-gulirkan-pemakzulan-gibran-golkar-solid-kawal-pemerintahan-yang-sah-hingga-2029,
Kementerian PU Sebut Biaya Pembangunan Satu Sekolah Rakyat Baru Mencapai Rp 100 Miliar,"Kamis, 8 Mei 2025 06:17 WIB",https://www.tribunnews.com/bisnis/2025/05/08/kementerian-pu-sebut-biaya-pembangunan-satu-sekolah-rakyat-baru-mencapai-rp-100-miliar,
